{
  "$schema": "https://json-schema.org/draft/2020-12/schema",
  "title": "Provider",
  "type": "object",
  "properties": {
    "provider": {
      "type": "string",
      "examples": [
        "ollama",
        "heuristai",
        "chutesai",
        "openai",
        "anthropic",
        "xai",
        "google",
        "openrouter"
      ]
    },
    "model": {
      "type": "string"
    },
    "config": {
      "type": "object"
    },
    "plugin": {
      "$comment": "Plugin to be loaded by the Studio to interact with the provider",
      "enum": ["openai-compatible", "ollama", "anthropic", "google", "custom"]
    },
    "plugin_config": {
      "type": "object"
    }
  },
  "allOf": [
    {
      "if": {
        "properties": {
          "provider": { "const": "ollama" }
        }
      },
      "then": {
        "properties": {
          "plugin": {
            "const": "ollama"
          }
        }
      }
    },
    {
      "if": {
        "properties": {
          "provider": { "const": "xai" }
        }
      },
      "then": {
        "properties": {
          "plugin": {
            "const": "openai-compatible"
          },
          "model": {
            "enum": ["grok-3"]
          }
        }
      }
    },
    {
      "if": {
        "properties": {
          "provider": { "const": "google" }
        }
      },
      "then": {
        "properties": {
          "plugin": {
            "const": "google"
          },
          "model": {
            "enum": [
              "gemini-2.0-flash-lite-001",
              "gemini-2.5-flash-lite",
              "gemini-2.5-flash",
              "gemini-3.0-flash",
              "gemini-2.5-flash-lite"
            ]
          }
        }
      }
    },
    {
      "if": {
        "properties": {
          "provider": { "const": "heuristai" }
        }
      },
      "then": {
        "properties": {
          "plugin": {
            "const": "openai-compatible"
          },
          "model": {
            "enum": [
              "deepseek/deepseek-v3",
              "mistralai/mixtral-8x7b-instruct",
              "meta-llama/llama-3.3-70b-instruct"
            ]
          }
        }
      }
    },
    {
      "if": {
        "properties": {
          "provider": { "const": "chutesai" }
        }
      },
      "then": {
        "properties": {
          "plugin": {
            "const": "openai-compatible"
          },
          "model": {
            "enum": [
              "zai-org/GLM-5-Turbo",
              "zai-org/GLM-4.7-TEE",
              "moonshotai/Kimi-K2.5-TEE",
              "MiniMaxAI/MiniMax-M2.5-TEE",
              "Qwen/Qwen3.5-397B-A17B-TEE",
              "deepseek-ai/DeepSeek-V3.1-TEE",
              "Qwen/Qwen3-32B",
              "Qwen/Qwen2.5-72B-Instruct"
            ]
          }
        }
      }
    },
    {
      "if": {
        "properties": {
          "provider": { "const": "openrouter" }
        }
      },
      "then": {
        "properties": {
          "plugin": {
            "const": "openai-compatible"
          },
          "model": {
            "enum": [
              "@preset/rally-testnet-gpt-5-1",
              "@preset/rally-testnet-sonnet-4-5",
              "@preset/rally-testnet-gemini-3-flash",
              "@preset/rally-testnet-qwen-3-5",
              "@preset/rally-testnet-deepseek-3-2",
              "@preset/rally-testnet-kimi-2-5",
              "@preset/rally-testnet-glm-5",
              "openai/gpt-5.2",
              "openai/gpt-5.1",
              "openai/gpt-5-mini",
              "z-ai/glm-4.7",
              "moonshotai/kimi-k2-0905",
              "moonshotai/kimi-k2.5",
              "deepseek/deepseek-v3.2",
              "qwen/qwen3-235b-a22b-2507",
              "anthropic/claude-sonnet-4.5",
              "google/gemini-3-flash-preview",
              "x-ai/grok-4",
              "mistralai/mistral-large-2512",
              "meta-llama/llama-4-maverick",
              "nvidia/llama-3.1-nemotron-ultra-253b-v1"
            ]
          }
        }
      }
    },
    {
      "if": {
        "properties": {
          "provider": { "const": "ionet" }
        }
      },
      "then": {
        "properties": {
          "plugin": {
            "const": "openai-compatible"
          },
          "model": {
            "enum": [
              "deepseek-ai/DeepSeek-V3.2",
              "meta-llama/Llama-4-Maverick-17B-128E-Instruct-FP8"
            ]
          }
        }
      }
    },
    {
      "if": {
        "properties": {
          "provider": { "const": "openai" }
        }
      },
      "then": {
        "properties": {
          "plugin": {
            "const": "openai-compatible"
          },
          "model": {
            "enum": [
              "gpt-4-1106-preview",
              "gpt-4o",
              "gpt-4.1-mini",
              "gpt-4.1-nano",
              "gpt-4.1",
              "gpt-5",
              "gpt-5-mini",
              "gpt-5-nano",
              "gpt-5.1",
              "gpt-5.1-nano"
            ]
          }
        }
      }
    },
    {
      "if": {
        "properties": {
          "provider": { "const": "anthropic" }
        }
      },
      "then": {
        "properties": {
          "plugin": {
            "const": "anthropic"
          },
          "model": {
            "enum": [
              "claude-3-7-sonnet-20250219",
              "claude-3-5-haiku-20241022",
              "claude-sonnet-4-20250514",
              "claude-opus-4-20250514",
              "claude-sonnet-4-5",
              "claude-opus-4-5"
            ]
          }
        }
      }
    },
    {
      "if": {
        "properties": {
          "plugin": { "const": "ollama" }
        }
      },
      "then": {
        "properties": {
          "plugin_config": {
            "type": "object",
            "additionalProperties": false,
            "properties": {
              "api_key_env_var": {
                "type": "string",
                "$comment": "Environment variable that contains the API key",
                "default": "<no-key>",
                "minLength": 1
              },
              "api_url": {
                "type": ["string", "null"],
                "$comment": "URL of the API endpoint"
              }
            }
          },

          "config": {
            "type": "object",
            "additionalProperties": false,
            "properties": {
              "mirostat": {
                "type": "integer",
                "minimum": 0,
                "maximum": 2,
                "default": 0
              },

              "mirostat_eta": {
                "type": "number",
                "minimum": 0,
                "maximum": 1,
                "multipleOf": 0.01,
                "default": 0.1
              },
              "microstat_tau": {
                "type": "number",
                "minimum": 0,
                "maximum": 10,
                "multipleOf": 0.1,
                "default": 5
              },
              "num_ctx": {
                "enum": [512, 1028, 2048, 4096],
                "default": 2048,
                "$comment": "this needs to be a per model value"
              },
              "num_qga": {
                "type": "integer",
                "minimum": 1,
                "maximum": 20,
                "default": 8
              },
              "num_gpu": {
                "type": "integer",
                "minimum": 0,
                "maximum": 16,
                "default": 0
              },
              "num_thread": {
                "type": "integer",
                "minimum": 1,
                "maximum": 16,
                "default": 2
              },
              "repeat_last_n": {
                "enum": [8, 16, 32, 64, 128, 256, 512, 1024, 2048, 4096],
                "default": 64
              },
              "repeat_penalty": {
                "type": "number",
                "minimum": 1.0,
                "maximum": 2.0,
                "multipleOf": 0.1,
                "default": 1.1
              },
              "temprature": {
                "type": "number",
                "minimum": 0,
                "maximum": 1.5,
                "multipleOf": 0.1,
                "default": 0.8
              },
              "seed": {
                "type": "integer",
                "minimum": 0,
                "maximum": 1000000,
                "default": 0
              },
              "stop": {
                "const": "",
                "default": ""
              },
              "tfs_z": {
                "type": "number",
                "minimum": 1.0,
                "maximum": 2.0,
                "multipleOf": 0.1,
                "default": 1.0
              },
              "num_predict": {
                "enum": [-2, -1, 32, 64, 128, 256, 512],
                "default": 128
              },
              "top_k": {
                "type": "integer",
                "minimum": 2,
                "maximum": 100,
                "default": 40
              },
              "top_p": {
                "type": "number",
                "minimum": 0.5,
                "maximum": 0.99,
                "multipleOf": 0.01,
                "default": 0.9
              }
            },
            "required": [
              "mirostat",
              "mirostat_eta",
              "microstat_tau",
              "num_ctx",
              "num_qga",
              "num_gpu",
              "num_thread",
              "repeat_last_n",
              "repeat_penalty",
              "temprature",
              "seed",
              "stop",
              "tfs_z",
              "num_predict",
              "top_k",
              "top_p"
            ]
          }
        }
      }
    },
    {
      "if": {
        "properties": {
          "plugin": { "const": "openai-compatible" }
        }
      },
      "then": {
        "properties": {
          "plugin_config": {
            "type": "object",
            "additionalProperties": false,
            "properties": {
              "api_key_env_var": {
                "type": "string",
                "$comment": "Environment variable that contains the API key",
                "default": "OPENAIKEY",
                "minLength": 1
              },
              "api_url": {
                "type": ["string", "null"],
                "$comment": "URL of the API endpoint. Leave empty to use the official OpenAI API endpoint."
              },
              "mock_response": {
                "type": "object",
                "$comment": "Mock LLM responses"
              },
              "mock_web_response": {
                "type": "object",
                "$comment": "Mock web responses"
              }
            },
            "required": ["api_key_env_var", "api_url"]
          },
          "config": {
            "type": "object",
            "additionalProperties": false,
            "properties": {
              "temperature": {
                "type": "number",
                "minimum": 0,
                "maximum": 1,
                "multipleOf": 0.05,
                "default": 0.75
              },
              "max_tokens": {
                "type": "integer",
                "minimum": 100,
                "maximum": 2000,
                "multipleOf": 10,
                "default": 500
              },
              "use_max_completion_tokens": {
                "type": "boolean",
                "default": false
              }
            }
          }
        }
      }
    },
    {
      "if": {
        "properties": {
          "plugin": { "const": "google" }
        }
      },
      "then": {
        "properties": {
          "plugin_config": {
            "type": "object",
            "additionalProperties": false,
            "properties": {
              "api_key_env_var": {
                "type": "string",
                "$comment": "Environment variable that contains the API key",
                "default": "GEMINI_API_KEY",
                "minLength": 1
              },
              "api_url": {
                "type": ["string", "null"],
                "$comment": "URL of the API endpoint"
              }
            },
            "required": ["api_key_env_var", "api_url"]
          },
          "config": {
            "type": "object",
            "additionalProperties": false,
            "properties": {
              "temperature": {
                "type": "number",
                "minimum": 0,
                "maximum": 1,
                "multipleOf": 0.05,
                "default": 0.75
              },
              "max_tokens": {
                "type": "integer",
                "minimum": 100,
                "maximum": 2000,
                "multipleOf": 10,
                "default": 500
              }
            }
          }
        }
      }
    },
    {
      "if": {
        "properties": {
          "plugin": { "const": "anthropic" }
        }
      },
      "then": {
        "properties": {
          "plugin_config": {
            "type": "object",
            "additionalProperties": false,
            "properties": {
              "api_key_env_var": {
                "type": "string",
                "$comment": "Environment variable that contains the API key",
                "default": "ANTHROPIC_API_KEY",
                "minLength": 1
              },
              "api_url": {
                "type": ["string", "null"],
                "$comment": "URL of the API endpoint. Leave empty to use the official anthropic endpoint."
              }
            },
            "required": ["api_key_env_var", "api_url"]
          },
          "config": {
            "type": "object",
            "additionalProperties": false,
            "properties": {
              "temperature": {
                "type": "number",
                "minimum": 0,
                "maximum": 1,
                "multipleOf": 0.05,
                "default": 0.75
              },
              "max_tokens": {
                "type": "integer",
                "minimum": 100,
                "maximum": 2000,
                "multipleOf": 10,
                "default": 500
              },
              "top_k": {
                "type": "integer",
                "minimum": 2,
                "maximum": 100,
                "default": 40
              },
              "top_p": {
                "type": "number",
                "minimum": 0.5,
                "maximum": 0.99,
                "multipleOf": 0.01,
                "default": 0.9
              },
              "timeout": {
                "type": "integer",
                "minimum": 1,
                "maximum": 60,
                "default": 10
              },
              "stop_sequences": {
                "type": "array",
                "items": {
                  "type": "string"
                },
                "default": []
              }
            }
          }
        }
      }
    },
    {
      "if": {
        "properties": {
          "plugin": { "const": "custom" }
        }
      },
      "then": {
        "properties": {
          "plugin_config": {
            "type": "object",
            "additionalProperties": false,
            "properties": {
              "api_key_env_var": {
                "type": "string",
                "$comment": "Environment variable that contains the API key",
                "minLength": 1
              },
              "api_url": {
                "type": ["string", "null"],
                "$comment": "URL of the API endpoint"
              }
            },
            "required": ["api_key_env_var", "api_url"]
          },
          "config": {
            "type": "object",
            "additionalProperties": false,
            "properties": {
              "temperature": {
                "type": "number",
                "minimum": 0,
                "maximum": 1,
                "multipleOf": 0.05,
                "default": 0.75
              },
              "max_tokens": {
                "type": "integer",
                "minimum": 100,
                "maximum": 2000,
                "multipleOf": 10,
                "default": 500
              }
            }
          }
        }
      }
    }
  ],
  "required": ["provider", "model", "config", "plugin", "plugin_config"],
  "additionalProperties": false
}
