{
  "provider": "anthropic",
  "plugin": "anthropic",
  "model": "claude-4-opus-20240515",
  "config": {
    "temperature": 0.80,
    "max_tokens": 600,
    "top_k": 50,
    "top_p": 0.95,
    "timeout": 15
  },
  "plugin_config": {
    "api_key_env_var": "ANTHROPIC_API_KEY",
    "api_url": null
  }
}